{
  "receipt_id": "RCP-AISIO-20260622-0001",
  "agent_id": "BR-AISIO-010",
  "agent_name": "aisio",
  "type": "gate_validation",
  "timestamp": "2026-06-22T16:33:00-03:00",
  "action": {
    "description": "Governance audit TASK-TEST-2026-06-22-001",
    "target": "pipeline_code_flow",
    "params": {"rules_tested": ["flow_classification","spec_existence","execution_proof","artifact_existence","no_orchestrator_skip"]}
  },
  "outcome": {
    "status": "success",
    "summary": "5/5 rules PASSED. Flow: fabio->ezra->artur(independent subagent)->baruch(independent subagent)->aisio. No delegation skip."
  },
  "evidence": {
    "files_created": ["agents/governance/governance-ledger.jsonl"],
    "files_modified": [],
    "output": "VERDICT: APPROVED"
  },
  "worklog_entry": "worklog.jsonl@2026-06-22T16:33:00-03:00"
}
