{
  "receipt_id": "RCP-JUSTUS-20260624-0001",
  "agent_id": "BR-JUSTUS-027",
  "agent_name": "justus",
  "type": "job_application",
  "timestamp": "2026-06-24T10:00:00-03:00",
  "action": {
    "description": "Full job hunt procedure - 15 apps, email scan, stats report",
    "target": "external"
  },
  "outcome": {
    "status": "success",
    "summary": "15 apps sent, 2 recruiter replies found (Sagan, Pyyne), 10 bounces identified, stats report delivered"
  },
  "evidence": {
    "companies": ["Sierra Studio","Arctiq","Genie AI","Spectraforce","Brightfin","GFT","Pulsora","Centralize","Continued","RYZ Labs","Netomi","CodiLime","TRM Labs","Software Mind","Acquia"],
    "files_modified": ["cache.json","state.json"]
  }
}
