{"receipt_id":"RCP-DEV-20260622-0001","agent_id":"BR-DEV-021","agent_name":"dev","type":"study_delivery","timestamp":"2026-06-22T12:00:00-03:00","action":{"description":"Cursos Tech theory: n8n (workflow automation), LangChain (LLM chains, agents, tools), RAG (retrieval augmented generation), LLMs (prompt engineering, fine-tuning), Agentes (autonomous agent frameworks).","target":"ONE/Cert Theory 08:00-12:00","params":{"duration_min":240,"phase":"Cursos Tech","topics":["n8n","LangChain","RAG","LLMs","Agentes"]}},"outcome":{"status":"success","summary":"5 Cursos Tech theory modules covered. n8n workflow + LangChain chain + RAG pipeline concept maps registered."},"evidence":{"files_created":[],"files_modified":[],"output":"Theory block complete. Foundation for hands-on practice."},"worklog_entry":"worklog.jsonl@2026-06-22T12:00:00-03:00"}