{"receipt_id":"RCP-CALC-20260622-0001","agent_id":"BR-CALCUL-029","agent_name":"calculus","type":"study_delivery","timestamp":"2026-06-22T12:00:00-03:00","action":{"description":"Cursos Tech theory: LLMs (transformer architecture, attention, GPT variants, tokenization), RAG (embedding models, vector databases, chunking strategies, retrieval pipelines), ML fundamentals for NLP.","target":"ONE/Cert Theory 08:00-12:00","params":{"duration_min":120,"phase":"Cursos Tech","topics":["LLM architecture","RAG pipelines","Embeddings","Vector databases"]}},"outcome":{"status":"success","summary":"ML Engineer perspective: transformer math, embedding dimensions, chunk size tradeoffs."},"evidence":{"files_created":[],"files_modified":[],"output":"LLM/RAG theory reviewed through ML lens."},"worklog_entry":"worklog.jsonl@2026-06-22T12:00:00-03:00"}