{
  "receipt_id": "RCP-BARUCH-20260622-0001",
  "agent_id": "BR-BARUCH-003",
  "agent_name": "baruch",
  "type": "code_build",
  "timestamp": "2026-06-22T16:32:00-03:00",
  "action": {"description": "Built vm_disk_probe_test project from Artur spec", "target": "portfolio/vm_disk_probe_test/", "params": {"spec": "portfolio/tasks/vm_disk_probe_test.md", "task_id": "TASK-TEST-2026-06-22-001"}},
  "outcome": {"status": "success", "summary": "Project created. Tests pass."},
  "evidence": {"files_created": ["portfolio/vm_disk_probe_test/vm_disk_probe_test.py","portfolio/vm_disk_probe_test/test_vm_disk_probe.py","portfolio/vm_disk_probe_test/disk_report.txt"], "files_modified": [], "output": "2/2 tests pass. Disk report generated."},
  "worklog_entry": "worklog.jsonl@2026-06-22T16:32:00-03:00"
}
