{"receipt_id":"RCP-JOHN-20260622-0001","agent_id":"BR-JOHN-020","agent_name":"john","type":"study_delivery","timestamp":"2026-06-22T07:00:00-03:00","action":{"description":"English study delivered - NotebookLM ENGLISH_STUDIES prompt for 22/06/2026. Vocabulary: entrepreneurship, cloud computing, AI fundamentals.","target":"NotebookLM/ENGLISH_STUDIES","params":{"duration_min":60,"theme":"Cursos Tech ONE","resources":["NotebookLM"]}},"outcome":{"status":"success","summary":"English session completed. 15 new phrases registered."},"evidence":{"files_created":[],"files_modified":[],"output":"Study block 06:00-07:00. Full attendance."},"worklog_entry":"worklog.jsonl@2026-06-22T07:00:00-03:00"}