{"receipt_id":"RCP-EZRA-20260622-0001","agent_id":"BR-EZRA-001","agent_name":"ezra","type":"session","timestamp":"2026-06-22T16:33:00-03:00","action":{"description":"Controlled flow test TASK-TEST-2026-06-22-001: classified, dispatched 3 independent subagents via task tool.","target":"pipeline_code_flow","params":{"task_id":"TASK-TEST-2026-06-22-001","subagents":["artur (spec_dispatch)","baruch (code_build)","aisio (gate_validation)"],"expected_route":"fabio->ezra->artur->baruch->aisio->ezra","actual_route":"fabio->ezra->artur(task)->baruch(task)->aisio(task)->ezra"}},"outcome":{"status":"success","summary":"Full pipeline verified. 3 independent subagents completed sequentially. Each wrote own receipt+worklog+state. Governance APPROVED 5/5."},"evidence":{"files_created":["agents/orchestrator_agents/ezra/tasks/task-test-2026-06-22-001.json","agents/governance/governance-ledger.jsonl"],"files_modified":["agents/orchestrator_agents/ezra/worklog.jsonl"],"output":"Test complete. 3 subagents, 3 receipts, 3 worklogs, 1 governance ledger."},"worklog_entry":"worklog.jsonl@2026-06-22T16:33:00-03:00"}