{"receipt_id":"RCP-CERTS-20260622-0001","agent_id":"BR-GOOGLE-025","agent_name":"certifications","type":"study_delivery","timestamp":"2026-06-22T12:00:00-03:00","action":{"description":"Cursos Tech OCI content delivered. Theory block: OCI architecture, compute (VM, BM, dedicated), storage (object, block, file), networking (VCN, LB, DRG), IAM (compartments, policies, groups).","target":"ONE/Cert Theory 08:00-12:00","params":{"duration_min":240,"phase":"Cursos Tech","topics":["OCI architecture","Compute","Storage","Networking","IAM"],"platform":"Oracle Cloud Free Tier"}},"outcome":{"status":"success","summary":"4h OCI theory completed. Hands-on: created compartment, VCN, compute instance in free tier."},"evidence":{"files_created":[],"files_modified":[],"output":"Theory block complete. 5 OCI modules reviewed."},"worklog_entry":"worklog.jsonl@2026-06-22T12:00:00-03:00"}