{"receipt_id":"RCP-BADGE-20260622-0001","agent_id":"BR-BADGE-030","agent_name":"badge","type":"study_delivery","timestamp":"2026-06-22T09:00:00-03:00","action":{"description":"OCI Foundations Associate (1Z0-1085-25) study - Segunda-feira rotation. Syllabus: OCI regions, compartments, compute shapes, storage tiers, VCN, IAM.","target":"ONE/Cert block","params":{"duration_min":60,"certification":"OCI Foundations Associate","exam_code":"1Z0-1085-25","day":"Segunda-feira","week":1}},"outcome":{"status":"success","summary":"Certification rotation completed. Topics reviewed: OCI regions, compartments, compute, storage, networking."},"evidence":{"files_created":[],"files_modified":[],"output":"Certification track #1 complete. Next: Ter - OCI AI Foundations."},"worklog_entry":"worklog.jsonl@2026-06-22T09:00:00-03:00"}