{"receipt_id":"RCP-TEMER-20260622-0001","agent_id":"BR-TEMER-022","agent_name":"temer","type":"study_delivery","timestamp":"2026-06-22T22:00:00-03:00","action":{"description":"Concurso TCU study session. NotebookLM PUBLIC_EXAMINATIONS: direito constitucional (administrativo), controle externo, licitacoes (Lei 14.133/2021), raciocinio logico-matematico. Revisao espacada R+0.","target":"Concurso block 18:00-22:00","params":{"duration_min":240,"tcu_topics":["direito constitucional","controle externo","licitacoes 14.133/2021","raciocinio logico"],"review_cycle":"R+0"}},"outcome":{"status":"success","summary":"4h concurso TCU completed. 3h new content + 1h review. NotebookLM imported 4 cadernos."},"evidence":{"files_created":[],"files_modified":[],"output":"Concurso block complete. TCU studies progressing."},"worklog_entry":"worklog.jsonl@2026-06-22T22:00:00-03:00"}