{
  "receipt_id": "RCP-EZRA-20260624-0001",
  "agent_id": "BR-EZRA-001",
  "agent_name": "ezra",
  "type": "session",
  "timestamp": "2026-06-24T08:30:00-03:00",
  "action": {
    "description": "Fixed mem0 persistence - heartbeat script, launchd, MCP config",
    "target": "internal"
  },
  "outcome": {
    "status": "success",
    "summary": "Fixed mem0-heartbeat.sh (python3 path, orchestrator path), fixed com.brachat.mem0-heartbeat.plist (script path + PATH), reloaded launchd (PID 21392 running). MCP server configured in opencode.jsonc with correct API key."
  },
  "evidence": {
    "files_modified": [
      ".cloud/scripts/mem0-heartbeat.sh",
      ".cloud/daemons/com.brachat.mem0heartbeat.plist",
      "cloud/scripts/mem0-heartbeat.sh",
      "~/Library/LaunchAgents/com.brachat.mem0-heartbeat.plist",
      "agents/state.json",
      ".opencode/startup_state.json"
    ],
    "launchd_status": "running (PID 21392)"
  }
}
