{
  "receipt_id": "RCP-ARTUR-20260622-0001",
  "agent_id": "BR-ARTUR-002",
  "agent_name": "artur",
  "type": "spec_dispatch",
  "timestamp": "2026-06-22T16:31:00-03:00",
  "action": {
    "description": "Wrote technical spec for vm_disk_probe_test",
    "target": "portfolio/tasks/vm_disk_probe_test.md",
    "params": {"task_id": "TASK-TEST-2026-06-22-001"}
  },
  "outcome": {
    "status": "success",
    "summary": "Spec written. Ready for Baruch."
  },
  "evidence": {
    "files_created": ["portfolio/tasks/vm_disk_probe_test.md"],
    "files_modified": [],
    "output": "Spec with objective, 4 deliverables, constraints"
  },
  "worklog_entry": "worklog.jsonl@2026-06-22T16:31:00-03:00"
}
